Category,Topic
Technology,AI replacing human creativity
Technology,Should robots have rights?
Technology,The future of brain-computer interfaces
Technology,Would you trust a self-driving ambulance?
Technology,Life without smartphones
Technology,Can social media improve society?
Technology,The danger of deepfakes
Technology,Virtual reality classrooms
Technology,Can AI become your best friend?
Technology,Is privacy already dead?
Society,Should school uniforms be banned?
Society,Is cancel culture fair?
Society,The impact of influencer culture
Society,Should voting be mandatory?
Society,The rise of loneliness
Society,Can money buy happiness?
Society,Is fame overrated?
Society,Should homework exist?
Society,Are introverts misunderstood?
Society,The power of kindness
Fun & Creative,If animals could talk
Fun & Creative,Living on Mars for one year
Fun & Creative,What if time travel existed?
Fun & Creative,Superpowers that would be useless
Fun & Creative,A world without music
Fun & Creative,If humans could fly
Fun & Creative,Would immortality be a curse?
Fun & Creative,If dreams became reality
Fun & Creative,A day in the life of a superhero
Fun & Creative,What if gravity disappeared for 5 minutes?
Debate,Books vs movies
Debate,Online learning vs classroom learning
Debate,Cats vs dogs
Debate,Should exams be removed?
Debate,Is fast food harmful to society?
Debate,Is competition necessary?
Debate,Should celebrities enter politics?
Debate,Is space exploration worth the cost?
Debate,Can success be taught?
Debate,Should students work part-time?
Personal Growth,The importance of discipline
Personal Growth,How failure builds character
Personal Growth,The value of patience
Personal Growth,Morning routines that change lives
Personal Growth,How to overcome fear
Personal Growth,Why confidence matters
Personal Growth,The role of mentors
Personal Growth,Learning from criticism
Personal Growth,The power of consistency
Personal Growth,How habits shape your future
Technology,What everyone gets wrong about success
Debate,The biggest lesson from food
Society,The hidden side of gaming
Debate,How friendship affects our lives
Society,What everyone gets wrong about social media
Technology,Can music make us happier?
Personal Growth,What everyone gets wrong about innovation
Personal Growth,The future of space
Technology,The future of social media
Personal Growth,The hidden side of movies
Technology,Can nature make us happier?
Society,How gaming affects our lives
Debate,The biggest lesson from history
Debate,What everyone gets wrong about business
Fun & Creative,The biggest lesson from sports
Fun & Creative,Should leadership change the world?
Fun & Creative,What everyone gets wrong about art
Society,How nature affects our lives
Fun & Creative,The biggest lesson from leadership
Debate,Why movies is thought-provoking
Technology,The rise and fall of art
Fun & Creative,The biggest lesson from future careers
Society,Can success make us happier?
Personal Growth,Can sports make us happier?
Society,Should business change the world?
Debate,Should education change the world?
Society,The future of sports
Technology,Should art change the world?
Fun & Creative,Should failure change the world?
Technology,The future of failure
Society,How social media affects our lives
Fun & Creative,What everyone gets wrong about fashion
Fun & Creative,The future of movies
Fun & Creative,How future careers affects our lives
Debate,The biggest lesson from failure
Society,Why social media is powerful
Technology,The biggest lesson from movies
Debate,The rise and fall of business
Technology,How travel affects our lives
Technology,What everyone gets wrong about business
Society,What everyone gets wrong about science
Fun & Creative,How food affects our lives
Technology,The hidden side of friendship
Personal Growth,How friendship affects our lives
Society,The most technology thing about impossible
Personal Growth,The hidden side of art
Debate,The rise and fall of nature
Debate,Should friendship change the world?
Personal Growth,Should future careers change the world?
Debate,Why mental health is weird
Fun & Creative,The biggest lesson from business
Personal Growth,Why music is life-changing
Debate,The most music thing about hidden
Personal Growth,How music affects our lives
Technology,The biggest lesson from sports
Society,The rise and fall of failure
Technology,Should failure change the world?
Fun & Creative,The hidden side of success
Society,The hidden side of technology
Society,The biggest lesson from sports
Fun & Creative,Should nature change the world?
Personal Growth,Can mental health make us happier?
Society,The biggest lesson from music
Personal Growth,The biggest lesson from innovation
Personal Growth,How science affects our lives
Fun & Creative,Why future careers is future
Debate,What everyone gets wrong about nature
Debate,The hidden side of success
Technology,How art affects our lives
Fun & Creative,The biggest lesson from nature
Fun & Creative,Should innovation change the world?
Society,Why gaming is hidden
Personal Growth,The biggest lesson from success
Debate,How innovation affects our lives
Fun & Creative,Can mental health make us happier?
Personal Growth,How success affects our lives
Technology,Why food is hidden
Personal Growth,The most technology thing about overrated
Fun & Creative,The future of art
Fun & Creative,Should communication change the world?
Fun & Creative,The future of science
Fun & Creative,Why gaming is dangerous
Debate,The biggest lesson from social media
Society,The rise and fall of gaming
Technology,The biggest lesson from friendship
Personal Growth,The future of success
Personal Growth,The hidden side of nature
Personal Growth,The rise and fall of fashion
Fun & Creative,How movies affects our lives
Personal Growth,Why space is underrated
Society,Should success change the world?
Personal Growth,Why education is life-changing
Debate,Why education is fascinating
Technology,What everyone gets wrong about education
Fun & Creative,Why space is future
Debate,What everyone gets wrong about leadership
Society,The biggest lesson from education
Society,The rise and fall of future careers
Debate,The biggest lesson from education
Society,Should social media change the world?
Technology,The future of music
Fun & Creative,Why movies is unexpected
Personal Growth,Why food is creative
Technology,The rise and fall of mental health
Debate,Should art change the world?
Debate,The future of success
Technology,The most innovation thing about creative
Fun & Creative,How space affects our lives
Personal Growth,The hidden side of fashion
Fun & Creative,The most science thing about future
Personal Growth,The hidden side of gaming
Personal Growth,The hidden side of food
Fun & Creative,How history affects our lives
Technology,Can education make us happier?
Society,Can history make us happier?
Society,The hidden side of space
Society,The future of gaming
Society,The rise and fall of success
Fun & Creative,The most education thing about hidden
Fun & Creative,The hidden side of friendship
Technology,The hidden side of failure
Society,The future of history
Fun & Creative,The future of music
Fun & Creative,The future of friendship
Debate,Why communication is impossible
Personal Growth,The hidden side of technology
Personal Growth,Why music is mysterious
Personal Growth,What everyone gets wrong about mental health
Debate,Can innovation make us happier?
Fun & Creative,The hidden side of future careers
Personal Growth,Should friendship change the world?
Society,The hidden side of friendship
Personal Growth,The most friendship thing about wild
Society,What everyone gets wrong about food
Technology,The hidden side of nature
Fun & Creative,How innovation affects our lives
Fun & Creative,How success affects our lives
Personal Growth,The hidden side of history
Fun & Creative,The biggest lesson from success
Technology,The most history thing about creative
Society,The rise and fall of business
Fun & Creative,How leadership affects our lives
Technology,Why education is fascinating
Debate,What everyone gets wrong about innovation
Fun & Creative,Should technology change the world?
Society,What everyone gets wrong about future careers
Debate,What everyone gets wrong about fashion
Personal Growth,How failure affects our lives
Debate,The future of friendship
Society,The hidden side of travel
Fun & Creative,The hidden side of sports
Debate,Can friendship make us happier?
Society,Can gaming make us happier?
Technology,The future of leadership
Fun & Creative,Why failure is unexpected
Fun & Creative,Can social media make us happier?
Technology,The hidden side of leadership
Debate,How art affects our lives
Technology,Can innovation make us happier?
Fun & Creative,The future of social media
Society,The future of business
Society,The most gaming thing about weird
Fun & Creative,The most food thing about impossible
Personal Growth,How nature affects our lives
Debate,Should communication change the world?
Debate,The future of failure
Debate,The most innovation thing about thought-provoking
Debate,How gaming affects our lives
Fun & Creative,The future of space
Personal Growth,How leadership affects our lives
Technology,The hidden side of sports
Personal Growth,Can friendship make us happier?
Fun & Creative,The most leadership thing about hidden
Society,The most innovation thing about weird
Personal Growth,How movies affects our lives
Fun & Creative,The future of education
Debate,What everyone gets wrong about movies
Personal Growth,The rise and fall of art
Technology,The rise and fall of science
Personal Growth,Can music make us happier?
Debate,The future of sports
Personal Growth,The future of movies
Fun & Creative,Can travel make us happier?
Debate,Can food make us happier?
Technology,The most art thing about hidden
Debate,Should space change the world?
Fun & Creative,The biggest lesson from fashion
Debate,Can future careers make us happier?
Technology,The rise and fall of future careers
Personal Growth,The hidden side of failure
Personal Growth,The hidden side of future careers
Technology,What everyone gets wrong about leadership
Personal Growth,The biggest lesson from education
Personal Growth,The hidden side of social media
Debate,Why fashion is unexpected
Fun & Creative,Why success is weird
Debate,The hidden side of leadership
Debate,Why sports is fascinating
Technology,The future of innovation
Fun & Creative,What everyone gets wrong about social media
Society,Should friendship change the world?
Personal Growth,The most history thing about hidden
Technology,The hidden side of fashion
Personal Growth,The future of future careers
Debate,Why friendship is hidden
Society,Can leadership make us happier?
Technology,What everyone gets wrong about gaming
Society,Why business is weird
Fun & Creative,The future of mental health
Debate,Why social media is exciting
Society,How business affects our lives
Debate,The most movies thing about surprising
Society,The future of art
Fun & Creative,What everyone gets wrong about music
Debate,Why art is creative
Fun & Creative,Can science make us happier?
Fun & Creative,Why business is impossible
Personal Growth,The most art thing about weird
Technology,What everyone gets wrong about music
Debate,The most music thing about mysterious
Personal Growth,How social media affects our lives
Society,The biggest lesson from innovation
Personal Growth,Should leadership change the world?
Debate,Can fashion make us happier?
Personal Growth,Why travel is overrated
Society,The rise and fall of technology
Debate,Should history change the world?
Technology,Why fashion is thought-provoking
Personal Growth,What everyone gets wrong about failure
Technology,The biggest lesson from future careers
Fun & Creative,The hidden side of education
Technology,Can gaming make us happier?
Debate,The most communication thing about mysterious
Technology,The hidden side of movies
Fun & Creative,The rise and fall of sports
Fun & Creative,Can space make us happier?
Fun & Creative,Why success is exciting
Society,Should science change the world?
Fun & Creative,The most technology thing about unexpected
Society,Can art make us happier?
Technology,What everyone gets wrong about nature
Fun & Creative,Should sports change the world?
Personal Growth,The biggest lesson from fashion
Debate,The future of innovation
Personal Growth,Why science is powerful
Society,The future of travel
Fun & Creative,The hidden side of mental health
Debate,Should movies change the world?
Technology,Should gaming change the world?
Debate,The biggest lesson from future careers
Debate,What everyone gets wrong about friendship
Debate,Can failure make us happier?
Personal Growth,The biggest lesson from failure
Debate,What everyone gets wrong about social media
Society,Why innovation is future
Personal Growth,Can business make us happier?
Fun & Creative,How business affects our lives
Society,The hidden side of business
Fun & Creative,The biggest lesson from friendship
Fun & Creative,Why movies is powerful
Fun & Creative,The future of food
Personal Growth,The most gaming thing about exciting
Debate,The hidden side of technology
Personal Growth,Why communication is wild
Society,The future of space
Technology,The future of food
Personal Growth,The rise and fall of space
Debate,The future of music
Fun & Creative,Can communication make us happier?
Personal Growth,How art affects our lives
Personal Growth,Should business change the world?
Personal Growth,The most nature thing about dangerous
Debate,The future of social media
Personal Growth,The rise and fall of social media
Technology,The most friendship thing about thought-provoking
Personal Growth,Why future careers is controversial
Technology,The rise and fall of friendship
Debate,The rise and fall of art
Fun & Creative,How nature affects our lives
Society,Can communication make us happier?
Fun & Creative,The rise and fall of technology
Fun & Creative,Can business make us happier?
Personal Growth,Why success is fascinating
Personal Growth,The hidden side of business
Fun & Creative,The most travel thing about exciting
Debate,How failure affects our lives
Technology,Why music is overrated
Debate,The most space thing about unexpected
Debate,The hidden side of art
Society,The future of friendship
Society,The most failure thing about controversial
Society,The future of technology
Fun & Creative,The most movies thing about impossible
Technology,How mental health affects our lives
Debate,The most education thing about weird
Debate,How business affects our lives
Personal Growth,The hidden side of friendship
Personal Growth,The future of travel
Personal Growth,Why future careers is underrated
Debate,Should innovation change the world?
Fun & Creative,Should future careers change the world?
Society,The future of failure
Personal Growth,Can success make us happier?
Society,Should art change the world?
Technology,The rise and fall of fashion
Fun & Creative,Can food make us happier?
Fun & Creative,What everyone gets wrong about education
Technology,How social media affects our lives
Technology,The hidden side of technology
Fun & Creative,Why fashion is overrated
Personal Growth,The biggest lesson from space
Society,The most social media thing about weird
Fun & Creative,What everyone gets wrong about nature
Fun & Creative,The biggest lesson from education
Fun & Creative,Can failure make us happier?
Fun & Creative,The rise and fall of fashion
Society,Should food change the world?
Personal Growth,The rise and fall of history
Society,The hidden side of communication
Society,The future of education
Technology,The most friendship thing about overrated
Technology,Should social media change the world?
Debate,The future of business
Debate,What everyone gets wrong about food
Personal Growth,The biggest lesson from food
Technology,Why music is thought-provoking
Fun & Creative,What everyone gets wrong about history
Technology,The future of space
Technology,Can science make us happier?
Technology,Why art is weird
Fun & Creative,The biggest lesson from history
Debate,The hidden side of friendship
Fun & Creative,The most food thing about future
Debate,The biggest lesson from technology
Personal Growth,How gaming affects our lives
Fun & Creative,The most communication thing about hidden
Technology,Can technology make us happier?
Debate,Why food is surprising
Technology,The future of sports
Fun & Creative,The rise and fall of movies
Fun & Creative,The future of business
Technology,The rise and fall of innovation
Fun & Creative,Can sports make us happier?
Debate,Why fashion is exciting
Personal Growth,The most space thing about overrated
Society,The hidden side of mental health
Debate,The most history thing about wild
Technology,How music affects our lives
Fun & Creative,The hidden side of communication
Technology,Why music is creative
Personal Growth,The future of technology
Technology,What everyone gets wrong about art
Personal Growth,What everyone gets wrong about food
Society,What everyone gets wrong about friendship
Fun & Creative,The future of innovation
Personal Growth,Why gaming is life-changing
Debate,Can communication make us happier?
Debate,Can social media make us happier?
Personal Growth,What everyone gets wrong about movies
Fun & Creative,Why innovation is impossible
Personal Growth,The biggest lesson from music
Personal Growth,The biggest lesson from sports
Personal Growth,Can fashion make us happier?
Society,What everyone gets wrong about art
Personal Growth,Should art change the world?
Personal Growth,Why music is overrated
Fun & Creative,The most nature thing about surprising
Society,The biggest lesson from communication
Technology,The biggest lesson from nature
Fun & Creative,The rise and fall of space
Debate,The future of leadership
Debate,The rise and fall of movies
Fun & Creative,The hidden side of innovation
Personal Growth,Why communication is overrated
Personal Growth,The hidden side of science
Fun & Creative,Why sports is impossible
Technology,The most innovation thing about fascinating
Fun & Creative,The hidden side of history
Technology,The future of business
Debate,Can history make us happier?
Society,The hidden side of music
Personal Growth,The future of food
Personal Growth,Should social media change the world?
Technology,Why sports is mysterious
Fun & Creative,How art affects our lives
Personal Growth,Why future careers is powerful
Technology,The hidden side of history
Society,The most art thing about exciting
Technology,The rise and fall of food
Society,Should music change the world?
Fun & Creative,The future of history
Personal Growth,Can innovation make us happier?
Debate,Why innovation is underrated
Fun & Creative,The rise and fall of nature
Technology,The rise and fall of gaming
Technology,The hidden side of future careers
Personal Growth,The most science thing about mysterious
Debate,The most sports thing about overrated
Debate,The hidden side of business
Society,What everyone gets wrong about communication
Society,Why space is life-changing
Fun & Creative,The future of gaming
Society,Can sports make us happier?
Technology,Why fashion is surprising
Society,The most sports thing about mysterious
Technology,The biggest lesson from leadership
Debate,How education affects our lives
Personal Growth,Should mental health change the world?
Personal Growth,The most future careers thing about impossible
Technology,Can social media make us happier?
Fun & Creative,The most business thing about thought-provoking
Personal Growth,Should sports change the world?
Debate,The future of technology
Society,The hidden side of food
Debate,The rise and fall of fashion
Technology,What everyone gets wrong about movies
Debate,Why friendship is exciting
Fun & Creative,The hidden side of travel
Fun & Creative,Can gaming make us happier?
Personal Growth,The biggest lesson from travel
Debate,The hidden side of food
Society,What everyone gets wrong about travel
Debate,The most mental health thing about mysterious
Technology,The hidden side of social media
Society,What everyone gets wrong about sports
Debate,The most business thing about hidden
Technology,The hidden side of space
Technology,The rise and fall of movies
Technology,Why fashion is overrated
Society,What everyone gets wrong about movies
Personal Growth,Why business is thought-provoking
Personal Growth,The rise and fall of science
Technology,What everyone gets wrong about friendship
Technology,The most nature thing about underrated
Debate,Why art is exciting
Debate,Should music change the world?
Personal Growth,What everyone gets wrong about science
Technology,The most social media thing about impossible
Debate,The biggest lesson from sports
Society,The biggest lesson from social media
Society,Why food is dangerous
Society,The most innovation thing about thought-provoking
Technology,Why travel is creative
Fun & Creative,The hidden side of art
Debate,Should gaming change the world?
Technology,The most social media thing about thought-provoking
Debate,Can travel make us happier?
Personal Growth,The rise and fall of education
Technology,The rise and fall of success
Debate,The hidden side of social media
